"http://ieeexplore.ieee.org/search/searchresult.jsp?bulkSetSize=57&matchBoolean%3Dtrue%26rowsPerPage%3D50%26searchField%3DSearch_All%26queryText%3D%28%28%28%28%28static%29+AND+code%29+AND+analysis%29+AND+software%29+AND+visualization%29",2014/10/23 18:15:41
"Extendable object visualisation for software reengineering","Muhlbacher, J.R.; Dietmuller, P.R.; Jobstl, M.","Dept. of Inf. Process. & Microtechnol. Technol., Johannes Kepler Univ., Linz, Austria","EUROMICRO Conference, 1999. Proceedings. 25th","1999","1999","2","","229","236 vol.2","This paper describes an experimental reengineering tool which assists the process of understanding the functionality of unknown software, particularly object oriented programs. In contrast to many other tools which analyse the source code, the inspected program is analysed at runtime by a concurrent process running in parallel. Information on all objects allocated by the inspected program is collected, in particular the dynamic type of each inspected object is determined. In contrast to the static type, the dynamic type of an object can only be determined at runtime. Each object is visualised by a corresponding visualisation class. Visualisation classes for well known data structures like binary trees can be used from the beginning. New visualisation can be derived by class extensions or can be added simply. The inspected program can be halted at specific locations to update the visualisation. Also, updating the visualisation can be triggered by specifying watch points","1089-6503","0-7695-0321-7","","10.1109/EURMIC.1999.794785","http://ieeexplore.ieee.org/stamp/stamp.jsp?arnumber=794785","","Binary trees;Data structures;Data visualization;Documentation;Information processing;Microprocessors;Runtime;Software tools;Tree data structures;Watches","object-oriented programming;program visualisation;systems re-engineering","data structures;dynamic type;functionality;object oriented programs;object visualisation;software reengineering;visualisation class","","","","0","","14","","","20020806","08 Sep 1999-10 Sep 1999","IEEE","","IEEE Conference Publications"
"Visualizing Feature Interaction in 3-D","Greevy, O.; Lanza, M.; Wysseier, C.","Berne Univ.","Visualizing Software for Understanding and Analysis, 2005. VISSOFT 2005. 3rd IEEE International Workshop on","0-0 0","2005","","","1","6","Without a clear understanding of how features of a software system are implemented, a maintenance change in one part of the code may risk adversely affecting other features. Feature implementation and relationships between features are not explicit in the code. To address this problem, we propose an interactive 3D visualization technique based on a combination of static and dynamic analysis which enables the software developer to step through visual representations of execution traces. We visualize dynamic behaviors of execution traces in terms of object creations and interactions and represent this in the context of a static class-hierarchy view of a system. We describe how we apply our approach to a case study to visualize and identify common parts of the code that are active during feature execution","","0-7803-9540-9","","10.1109/VISSOF.2005.1684317","http://ieeexplore.ieee.org/stamp/stamp.jsp?arnumber=1684317","","Control systems;Engines;Informatics;Information analysis;Reverse engineering;Runtime;Software maintenance;Software systems;Terminology;Visualization","computer graphics;program diagnostics;program visualisation;software maintenance","dynamic analysis;dynamic behavior visualization;execution traces;feature execution;feature implementation;feature interaction;interactive 3D visualization;maintenance change;object creations;object interactions;software system;static analysis;static class-hierarchy system view;visual representations","","","","3","","20","","","20061009","","IEEE","","IEEE Conference Publications"
"Design of a parser for real-time process algebra","Jianhua Zhao; Wang, Yingxu","Inst. of Comput. Sci. & Technol., Nanjing Univ., China","Electrical and Computer Engineering, 2003. IEEE CCECE 2003. Canadian Conference on","4-7 May 2003","2003","2","","1259","1262 vol.2","The real-time process algebra (RTFA) is a set of new mathematical notations for formally describing software system architectures, and static and dynamic behaviors. To bring RTPA into industrial software development practice, tools are needed for analyzing and visualizing RTPA specifications. The first step to develop the supporting tools is to build a grammar parser for recognizing the RTPA notation system. In this paper, a parser of RTPA is described. The parser takes a textual RTPA specification as input, and generates an abstract syntax tree (AST) as its output. The generated AST represents RTPA tokens and lexical information in a structured format, which provides a foundation for further semantic analysis, code generation, visualization, and validation.","0840-7789","0-7803-7781-8","","10.1109/CCECE.2003.1226128","http://ieeexplore.ieee.org/stamp/stamp.jsp?arnumber=1226128","","Algebra;Computer architecture;Computer industry;Computer science;Drives;Java;Real time systems;Software engineering;Software systems;Visualization","grammars;process algebra;real-time systems;software architecture;software tools","AST;RTFA;abstract syntax tree;grammar parser;real-time process algebra;software engineering;software system architecture;software tools","","","","3","","7","","","20030904","","IEEE","","IEEE Conference Publications"
"Analyzing Java software by combining metrics and program visualization","Systa, T.; Ping Yu; Muller, H.","Software Syst. Lab., Tampere Univ. of Technol., Finland","Software Maintenance and Reengineering, 2000. Proceedings of the Fourth European","Feb 2000","2000","","","199","208","Shimba, a prototype reverse engineering environment, has been built to support the understanding of Java software. Shimba uses Rigi and SCED to analyze, visualize, and explore the static and dynamic aspects, respectively, of the subject system. The static software artifacts and their dependencies are extracted from Java byte code and viewed as directed graphs using the Rigi reverse engineering environment. The static dependency graphs of a subject system can be annotated with attributes, such as software quality measures, and then be analyzed and visualised using scripts through the end user programmable interface. Shimba has recently been extended with the Chidamber and Kemerer suite of object oriented metrics. The metrics measure properties of the classes, the inheritance hierarchy, and the interaction among classes of a subject system. Since Shimba is primarily intended for the analysis and exploration of Java software, the metrics have been tailored to measure properties of software systems using a reverse engineering environment. The static dependency graphs of the system under investigation are decorated with measures obtained by applying the object oriented metrics to selected software components. Shimba provides tools to examine these measures, to find software artifacts that have values that are in a given range, and to detect correlations among different measures. The object oriented analysis of the subject Java system can be investigated further by exporting the measures to a spreadsheet","","0-7695-0546-5","","10.1109/CSMR.2000.827328","http://ieeexplore.ieee.org/stamp/stamp.jsp?arnumber=827328","","Computer science;Electrical capacitance tomography;Java;Laboratories;Prototypes;Read only memory;Reverse engineering;Software systems;Tail;Visualization","Java;directed graphs;inheritance;object-oriented programming;program visualisation;reverse engineering;software metrics;software quality","Chidamber;Java byte code;Java software;Kemerer suite;Rigi;Rigi reverse engineering environment;SCED;Shimba;directed graphs;dynamic aspects;end user programmable interface;inheritance hierarchy;metrics;object oriented analysis;object oriented metrics;program visualization;prototype reverse engineering environment;reverse engineering environment;software artifacts;software components;software quality measures;spreadsheet;static dependency graphs;static software artifacts;subject Java system;subject system","","","","11","3","25","","","20020806","29 Feb 2000-03 Mar 2000","IEEE","","IEEE Conference Publications"
"K-scope: A Java-Based Fortran Source Code Analyzer with Graphical User Interface for Performance Improvement","Terai, M.; Murai, H.; Minami, K.; Yokokawa, M.; Tomiyama, E.","RIKEN Adv. Inst. for Comput. Sci., Kobe, Japan","Parallel Processing Workshops (ICPPW), 2012 41st International Conference on","10-13 Sept. 2012","2012","","","434","443","Given that scientific computer programs are becoming larger and more complicated, high performance application developers routinely examine the program structure of their source code to improve their performance. We have developed K-scope, a source code analysis tool that can be used to improve code performance. K-scope has graphical user interface that visualizes program structures of Fortran 90 and FORTRAN 77 source code and enables static data-flow analysis. To develop the tool, we adopted the filtered abstract syntax tree (filtered-AST) model with Java to visualize the program structure efficiently. Filtered-AST, which extends the AST in the structured programming model by abstract block structuring, is suitable for visualization program structures. Based on this model, K-scope has been developed as an experimental implementation. It constructs filtered-AST objects from both source and intermediate code generated by the front-end of the XcalableMP compiler. We provide illustrations of the graphical user interface and give detailed examples of the tool applied to an actual application code.","1530-2016","978-1-4673-2509-7","","10.1109/ICPPW.2012.61","http://ieeexplore.ieee.org/stamp/stamp.jsp?arnumber=6337511","GUI;XcalableMP compiler;filtered-AST;single core performance improvement;static source code analysis","Analytical models;Computational modeling;Load modeling;Object oriented modeling;Syntactics;Visualization;XML","FORTRAN;Java;computational linguistics;data flow analysis;graphical user interfaces;natural sciences computing;program compilers;program visualisation;software performance evaluation;source coding;structured programming;tree data structures","FORTRAN 77 source code;Fortran 90 source code;Java-based Fortran source code analyzer;K-scope;XcalableMP compiler;abstract block structuring;code performance improvement;filtered abstract syntax tree model;filtered-AST model;graphical user interface;high performance application developers;program structure visualization;scientific computer programs;source code analysis tool;static data flow analysis;structured programming model","","","","0","","20","","","20121025","","IEEE","","IEEE Conference Publications"
"Dynamic Analysis of Software Systems using Execution Pattern Mining","Safyallah, H.; Sartipi, K.","Dept. of Comput. & Software, McMaster Univ., Hamilton, Ont.","Program Comprehension, 2006. ICPC 2006. 14th IEEE International Conference on","0-0 0","2006","","","84","88","Software system analysis for extracting system functionality remains as a major problem in the reverse engineering literature and the early approaches mainly rely on static properties of software. In this paper, we propose a novel technique for dynamic analysis of software systems to identify the implementation of the software features that are specified through a number of feature-specific task scenarios. The execution of task scenarios and application of data mining algorithm sequential pattern discovery on the generated traces allow us to extract common functionality associated with the corresponding feature-specific task scenarios. The extracted patterns are used to identify the groups of core functions that implement software features. The proposed approach can be used for program comprehension and feature to source code assignment. A case study on the Unix Xfig drawing tool has been provided","1092-8138","0-7695-2601-2","","10.1109/ICPC.2006.19","http://ieeexplore.ieee.org/stamp/stamp.jsp?arnumber=1631109","Dynamic Analysis;Execution;Feature Extraction.;Scenario;Sequential Pattern Mining;Trace","Application software;Data mining;Feature extraction;Optimization;Pattern analysis;Performance analysis;Reverse engineering;Software performance;Software systems;Visualization","data mining;program diagnostics;reverse engineering;systems analysis","Unix Xfig drawing tool;data mining;dynamic analysis;execution pattern mining;program comprehension;reverse engineering;sequential pattern discovery;software system analysis;source code assignment;system functionality extraction;task scenario execution","","","","13","1","11","","","20060626","","IEEE","","IEEE Conference Publications"
"A Combined Software Reconnaissance &amp; Static Analysis Eclipse Visualisation Plug-in","Cleary, B.; Le Gear, A.; Exton, C.; Buckley, J.","Dept. of Comput. Sci. & Inf. Syst., Univ. of Limerick","Visualizing Software for Understanding and Analysis, 2005. VISSOFT 2005. 3rd IEEE International Workshop on","0-0 0","2005","","","1","2","Software reconnaissance is a dynamic analysis technique which can aid in the mapping between program features and code that implements those features. In a previous case study we have shown how we were able to combine software reconnaissance with a static data analysis to a derive reuse perspective from an existing system. In this paper we report on the tool support, in the form of an eclipse plug-in, developed to aid in visualising the results of the combined dynamic and static analyses","","0-7803-9540-9","","10.1109/VISSOF.2005.1684319","http://ieeexplore.ieee.org/stamp/stamp.jsp?arnumber=1684319","","Computer science;Data analysis;Data visualization;Gears;Information systems;Instruments;Reconnaissance;Software testing;Software tools;Spatial databases","program diagnostics;program visualisation","Eclipse visualisation plug-in;dynamic analysis;program code mapping;program feature mapping;software reconnaissance;static analysis;static data analysis;tool support","","","","1","","7","","","20061009","","IEEE","","IEEE Conference Publications"
"Support for Static Concept Location with sv3D","Xinrong Xie; Poshyvanyk, D.; Marcus, A.","Dept. of Comput. Sci., Wayne State Univ., Detroit, MI","Visualizing Software for Understanding and Analysis, 2005. VISSOFT 2005. 3rd IEEE International Workshop on","0-0 0","2005","","","1","6","The paper presents a new visualization approach to support static concept location in source code. The approach is realized through the combination of two existing tools: IRiSS, which is an information retrieval based tool that support source code searching and browsing; and sv3D, which is a software visualization front end. Both tools are integrated into MS Visual Studio .NET. The motivation behind the approach, the definition of the visual mappings, and usage examples are also presented in the paper, together with an outline of future and related work","","0-7803-9540-9","","10.1109/VISSOF.2005.1684315","http://ieeexplore.ieee.org/stamp/stamp.jsp?arnumber=1684315","","Application software;Containers;Data visualization;Displays;Filtering;Information retrieval;Software engineering;Software metrics;Software systems;Software tools","data flow analysis;information retrieval;network operating systems;program visualisation;software engineering","IRiSS tool;MS Visual Studio .NET;information retrieval;software visualization front end;source code browsing;source code searching;source code static concept location support;sv3D tool;visual mappings","","","","0","","16","","","20061009","","IEEE","","IEEE Conference Publications"
"Move code refactoring with dynamic analysis","Kimura, S.; Higo, Y.; Igaki, H.; Kusumoto, S.","Grad. Sch. of Inf. Sci. &amp; Technol., Osaka Univ., Suita, Japan","Software Maintenance (ICSM), 2012 28th IEEE International Conference on","23-28 Sept. 2012","2012","","","575","578","In order to reduce coupling and increase cohesion, we refactor program source code. Previous research efforts for suggesting candidates of such refactorings are based on static analysis, which obtains relations among classes or methods from source code. However, these approaches cannot obtain runtime information such as repetition count of loop, dynamic dispatch and actual execution path. Therefore, previous approaches might miss some refactoring opportunities. To tackle this problem, we propose a technique to find refactoring candidates by analyzing method traces. We have implemented a prototype tool based on the proposed technique and evaluated the technique on two software systems. As a result, we confirmed that the proposed technique could detect some refactoring candidates, which increase code quality.","1063-6773","978-1-4673-2313-0","","10.1109/ICSM.2012.6405324","http://ieeexplore.ieee.org/stamp/stamp.jsp?arnumber=6405324","Move Method refactoring;dynamic analysis;refactoring;software maintenance","Cloning;Conferences;Data visualization;Image color analysis;Performance analysis;Software maintenance","program diagnostics;software maintenance;software quality;system monitoring","code quality;dynamic analysis;dynamic dispatch;method traces;program source code refactoring;runtime information;static analysis","","","","0","","8","","","20130110","","IEEE","","IEEE Conference Publications"
"An Eclipse plug-in for the detection of design pattern instances through static and dynamic analysis","De Lucia, A.; Deufemia, V.; Gravino, C.; Risi, M.","Dipt. di Mat. e Inf., Univ. degli Studi di Salerno, Fisciano, Italy","Software Maintenance (ICSM), 2010 IEEE International Conference on","12-18 Sept. 2010","2010","","","1","6","The extraction of design pattern information from software systems can provide conspicuous insight to software engineers on the software structure and its internal characteristics. In this demonstration we present ePAD, an Eclipse plug-in for recovering design pattern instances from object-oriented source code. The tool is able to recover design pattern instances through a structural analysis performed on a data model extracted from source code, and a behavioral analysis performed through the instrumentation and the monitoring of the software system. ePAD is fully configurable since it allows software engineers to customize the design pattern recovery rules and the layout used for the visualization of the recovered instances.","1063-6773","978-1-4244-8630-4","978-1-4244-8628-1","10.1109/ICSM.2010.5609707","http://ieeexplore.ieee.org/stamp/stamp.jsp?arnumber=5609707","Eclipse plug-in;design pattern recovery;reverse engineering;source code analysis","","object-oriented programming;program diagnostics;software tools","Eclipse plug-in;design pattern detection;design pattern information extraction;design pattern recovery rules;dynamic analysis;ePAD;object-oriented source code;software engineers;software systems;static analysis","","","","1","","22","","","20101025","","IEEE","","IEEE Conference Publications"
"Constellation visualization: Augmenting program dependence with dynamic information","Fang Deng; DiGiuseppe, N.; Jones, J.A.","Dept. of Inf., Univ. of California, Irvine, Irvine, CA, USA","Visualizing Software for Understanding and Analysis (VISSOFT), 2011 6th IEEE International Workshop on","29-30 Sept. 2011","2011","","","1","8","This paper presents a scalable, statement-level visualization that shows related code in a way that supports human interpretation of clustering and context. The visualization is applicable to many software-engineering tasks through the utilization and visualization of problem-specific meta-data. The visualization models statement-level code relations from a system-dependence-graph model of the program being visualized. Dynamic, run-time information is used to augment the static program model to further enable visual cluster identification and interpretation. In addition, we performed a user study of our visualization on an example program domain. The results of the study show that our new visualization successfully revealed relevant context to the programmer participants.","","978-1-4577-0822-0","978-1-4577-0821-3","10.1109/VISSOF.2011.6069453","http://ieeexplore.ieee.org/stamp/stamp.jsp?arnumber=6069453","","Color;Context;Layout;Scalability;Software;Springs;Visualization","data visualisation;graph theory;meta data;pattern clustering;software engineering","constellation visualization;dynamic run-time information;problem-specific meta-data utilization;problem-specific meta-data visualization;program dependence augmentation;scalable statement-level visualization;software-engineering tasks;statement-level code relations;system-dependence-graph model;visual cluster identification;visual cluster interpretation","","","","2","","15","","","20111103","","IEEE","","IEEE Conference Publications"
"Computation and visualization of cause-effect paths","Dubey, A.; Murthy, P.","Software Dev. Improvement Program, ABB Ltd., Bangalore, India","Automation of Software Test (AST), 2013 8th International Workshop on","18-19 May 2013","2013","","","139","145","Static analyzers detect possible run-time errors at compile-time and often employ data-flow analysis techniques to infer properties of programs. Usually, dataflow analysis tools report possible errors with line numbers in source code and leave the task of locating root causes of errors. This paper proposes a technique to aid developers in locating the root causes of statically identified run-time errors with the help of cause-effect paths. A cause effect path terminates at an erroneous statement and originates at the statement which is responsible for the error. We propose modifications to the classic data-flow analysis algorithm to compute cause-effect paths. We discuss different visualization modes in which cause-effect paths can be displayed. As a case study, we implemented a null pointer analyzer, with the additional capability of cause-effect path computation, using the Microsoft Phoenix framework. In addition, we propose a methodology to automatically generate an analyzer which computes cause-effect paths using a framework such as Microsoft Phoenix.","","","","10.1109/IWAST.2013.6595805","http://ieeexplore.ieee.org/stamp/stamp.jsp?arnumber=6595805","Static analysis;cause-effect paths;debugging;visualization","Abstracts;Algorithm design and analysis;Arrays;Indexes;Software;Transfer functions;Visualization","data flow analysis;data visualisation","Microsoft Phoenix framework;cause-effect path computation;cause-effect path visualization;compile-time;data-flow analysis techniques;null pointer analyzer;run-time errors;source code;static analyzers","","","","0","","17","","","20130912","","IEEE","","IEEE Conference Publications"
"Dynamic Trace-Based Data Dependency Analysis for Parallelization of C Programs","Lazarescu, M.T.; Lavagno, L.","Politec. di Torino, Turin, Italy","Source Code Analysis and Manipulation (SCAM), 2012 IEEE 12th International Working Conference on","23-24 Sept. 2012","2012","","","126","131","Writing parallel code is traditionally considered a difficult task, even when it is tackled from the beginning of a project. In this paper, we demonstrate an innovative toolset that faces this challenge directly. It provides the software developers with profile data and directs them to possible top-level, pipeline-style parallelization opportunities for an arbitrary sequential C program. This approach is complementary to the methods based on static code analysis and automatic code rewriting and does not impose restrictions on the structure of the sequential code or the parallelization style, even though it is mostly aimed at coarse-grained task-level parallelization. The proposed toolset has been utilized to define parallel code organizations for a number of real-world representative applications and is based on and is provided as free source.","","978-1-4673-2398-7","","10.1109/SCAM.2012.15","http://ieeexplore.ieee.org/stamp/stamp.jsp?arnumber=6392110","C program parallelization;C-to-C rewrite;KPN;data dependency analysis;execution trace;graph analysis","Context;Data visualization;Instruments;Libraries;Runtime;Software;Yarn","C language;data analysis;object-oriented programming;parallel programming;pipeline processing;software engineering","C programs;dynamic trace-based data dependency analysis;innovative toolset;parallel code;pipeline-style parallelization;software development","","","","0","","14","","","20121224","","IEEE","","IEEE Conference Publications"
